{
  "schemaVersion": "1.0.0",
  "version": "1.0.0",
  "id": "INV-DEVAI-019",
  "domain": "DEVAI",
  "lifecycle": "supported",
  "severity": "hard-fail",
  "type": "validation",
  "title": "Readiness aggregation and invariant alignment preserve measured semantics",
  "statement": "Composite sensor execution MUST distinguish process execution from readiness and MUST preserve pass, review, fail, unknown, N/A, and error without translating N/A, REVIEW, or UNKNOWN into PASS or binary FAIL; invariant alignment MUST require an executable fail-closed canonical action plus fresh successful candidate-bound evidence, and MUST reject comments, echoes, quoted commands, disabled or continue-on-error steps, ignored failures, and stale evidence.",
  "rationale": "Exit codes alone discard the uncertainty and applicability information the scorecard exists to preserve. Text presence is not proof that a requirement was executed or passed.",
  "status": "active",
  "verification": {
    "required_suites": [
      "unit",
      "int"
    ],
    "oracle": "tests",
    "strategy": {
      "primary": "regression",
      "deterministic_check_available": true,
      "rationale": "The registered test corpus provides deterministic regression evidence for this invariant."
    }
  },
  "authority": {
    "docs": [
      {
        "doc": "docs/meta/adr/ADR-004-published-truth-operational-self-adoption.md",
        "anchor": "decision-9-aggregate-readiness-and-alignment-semantics"
      }
    ],
    "decisions": [
      "D-139",
      "ADR-004"
    ]
  },
  "scope": {
    "components": [
      "sense-run",
      "scorecard-na",
      "harness-invariant-alignment"
    ],
    "code_areas": [
      "packages/cli/src/commands/sense/run-set.ts",
      "packages/sensors/src/harness-invariant-alignment.ts",
      ".devai/config/scorecard-na.json",
      ".github/workflows/**"
    ]
  },
  "change_policy": {
    "breaking_change_requires": [
      "doc_update",
      "trace_update",
      "test_update",
      "human_approval",
      "adr"
    ],
    "test_weakening_allowed": false,
    "human_approval_required": true
  },
  "tags": [
    "readiness",
    "n-a",
    "unknown",
    "alignment",
    "evidence",
    "article-39"
  ],
  "provenance": [
    "ex-INV-DEVAI-019@devai-original"
  ]
}