{
  "schemaVersion": "1.0.0",
  "version": "1.0.0",
  "id": "INV-DEVAI-006",
  "domain": "DEVAI",
  "severity": "hard-fail",
  "type": "data_contract",
  "title": "Scorecard composition is deterministic over a fixed reading set",
  "statement": "computeScorecard(readings, integration_head, timestamp) MUST return a Scorecard whose substrate \u00d7 property cells, substrate_aggregates, and overall verdict are a pure function of the input readings (and the static degenerate-cell table). Re-running with the same inputs MUST produce byte-identical output modulo the timestamp.",
  "rationale": "Article 33 makes the scorecard the auditor's canonical state estimate of the framework. Non-determinism in composition undermines every downstream comparison: scorecard-over-time, regression detection, backlog refresh. The composition must be a pure function of explicit inputs. Article 39 (explicit uncertainty over false precision) further requires that scorecard verdicts honestly distinguish UNKNOWN from PASS.",
  "status": "active",
  "verification": {
    "required_suites": [
      "int"
    ],
    "oracle": "tests",
    "strategy": {
      "primary": "regression",
      "deterministic_check_available": true,
      "rationale": "The registered test corpus provides deterministic regression evidence for this invariant."
    }
  },
  "authority": {
    "docs": [
      {
        "doc": "CONSTITUTION.md",
        "anchor": "article-33-auditor-as-state-estimator"
      },
      {
        "doc": "CONSTITUTION.md",
        "anchor": "article-39-explicit-uncertainty-over-false-precision"
      }
    ]
  },
  "scope": {
    "components": [
      "core",
      "cli"
    ],
    "code_areas": [
      "packages/core/src/loop/scorecard.ts",
      "packages/cli/src/commands/phase6/**"
    ]
  },
  "change_policy": {
    "breaking_change_requires": [
      "doc_update",
      "test_update",
      "human_approval",
      "adr"
    ],
    "test_weakening_allowed": false,
    "human_approval_required": true
  },
  "tags": [
    "phase-6",
    "scorecard",
    "determinism"
  ],
  "measurable_via": [
    "govern score assess",
    "govern score backlog refresh",
    "govern score compute",
    "govern score view"
  ],
  "provenance": [
    "ex-INV-DEVAI-006@devai-original"
  ]
}