{
  "schemaVersion": "1.0.0",
  "version": "1.0.0",
  "id": "INV-AUTH-004",
  "domain": "AUTH",
  "lifecycle": "supported",
  "severity": "hard-fail",
  "type": "audit",
  "title": "Authority metadata and evidence are fail-closed, non-capabilities, and readiness-honest",
  "statement": "Every live action MUST declare an explicit effect, constitutional authority subject, consent, planner, and final boundary with no default-to-read fallback; every governed mutation MUST emit secret-safe audit-only authority provenance, and shadow, dry-run, read, denial, ambiguity, unclassified targets, or unverified host posture MUST remain ineligible to promote supported readiness.",
  "rationale": "A correct decision cannot compensate for an action omitted from the registry, and durable evidence must never become a replayable capability or an inflated production-readiness claim.",
  "status": "active",
  "verification": {
    "required_suites": [
      "unit",
      "int",
      "e2e"
    ],
    "oracle": "tests",
    "strategy": {
      "primary": "regression",
      "deterministic_check_available": true,
      "rationale": "The registered test corpus provides deterministic regression evidence for this invariant."
    }
  },
  "authority": {
    "docs": [
      {
        "doc": "CONSTITUTION.md",
        "anchor": "article-39-explicit-uncertainty-over-false-precision"
      },
      {
        "doc": "docs/meta/adr/ADR-003-runtime-authority-enforcement.md",
        "anchor": "9-action-contract-and-staged-cutover"
      }
    ],
    "decisions": [
      "D-135",
      "ADR-003"
    ]
  },
  "scope": {
    "components": [
      "action-registry",
      "authority-evidence",
      "readiness",
      "host-enforcement"
    ],
    "code_areas": [
      "docs/framework/schemas/authority-action-contract.schema.json",
      "docs/framework/schemas/authority-evidence.schema.json",
      "packages/cli/src/**",
      "packages/core/src/authority/**"
    ]
  },
  "change_policy": {
    "breaking_change_requires": [
      "doc_update",
      "trace_update",
      "test_update",
      "human_approval",
      "adr"
    ],
    "test_weakening_allowed": false,
    "human_approval_required": true
  },
  "tags": [
    "authority",
    "action-contract",
    "evidence",
    "readiness",
    "cli-only",
    "fail-closed"
  ],
  "provenance": [
    "ex-INV-AUTH-004@devai-original"
  ]
}