{
  "schemaVersion": "1.0.0",
  "version": "1.0.0",
  "id": "INV-DEVAI-004",
  "domain": "DEVAI",
  "severity": "hard-fail",
  "type": "lifecycle",
  "title": "Task spawn composes lock + worktree + DB atomically",
  "statement": "devai work task spawn with --with-worktree and/or --with-db MUST compose the execution environment transactionally: if any downstream step fails after locks are held, the upstream steps already taken MUST be reversed (worktree destroyed, locks released) and the task MUST be persisted with status:cancelled and a rollback_reason. A failed spawn MUST NOT leave the substrate half-initialized.",
  "rationale": "Articles 25 (locks) and 27 (worktree discipline) jointly assume the harness can construct the per-task execution environment as a single transactional unit. Without rollback, the loop's central state machine corrupts the substrate on every partial failure, and lock leaks accumulate.",
  "status": "active",
  "verification": {
    "required_suites": [
      "int"
    ],
    "oracle": "tests",
    "strategy": {
      "primary": "regression",
      "deterministic_check_available": true,
      "rationale": "The registered test corpus provides deterministic regression evidence for this invariant."
    }
  },
  "authority": {
    "docs": [
      {
        "doc": "CONSTITUTION.md",
        "anchor": "article-25-module-level-semantic-locking"
      },
      {
        "doc": "CONSTITUTION.md",
        "anchor": "article-27-worktree-discipline"
      }
    ]
  },
  "scope": {
    "components": [
      "core",
      "cli"
    ],
    "code_areas": [
      "packages/core/src/loop/tasks.ts",
      "packages/core/src/loop/worktrees.ts",
      "packages/core/src/loop/db.ts",
      "packages/cli/src/commands/loop/**"
    ]
  },
  "change_policy": {
    "breaking_change_requires": [
      "doc_update",
      "test_update",
      "human_approval",
      "adr"
    ],
    "test_weakening_allowed": false,
    "human_approval_required": true
  },
  "tags": [
    "phase-5",
    "task-lifecycle",
    "atomicity"
  ],
  "measurable_via": [
    "work db drop",
    "work db provision",
    "work db rebuild template",
    "work db start shared",
    "work db status",
    "work db stop shared",
    "work task spawn",
    "work worktree create",
    "work worktree destroy"
  ],
  "provenance": [
    "ex-INV-DEVAI-004@devai-original"
  ]
}